{
  "$schema": "schemas/update-channel.schema.json",
  "schemaVersion": 1,
  "product": "LOKRO OS Desktop",
  "repository": "jamjam1312/LOKROOS-Arch-based",
  "channel": "alpha",
  "architecture": "x86_64",
  "version": "0.1.0-alpha.4",
  "releaseTag": "v0.1.0-alpha.4",
  "releaseApi": "https://api.github.com/repos/jamjam1312/LOKROOS-Arch-based/releases/tags/v0.1.0-alpha.4",
  "manifestUrl": "https://raw.githubusercontent.com/jamjam1312/LOKROOS-Arch-based/main/LOKRO_UPDATE_CHANNEL.json",
  "repositoryArchiveAsset": "lokro-repo-0.1.0-alpha.4.tar.zst",
  "repositoryArchiveChecksumAsset": "lokro-repo-0.1.0-alpha.4.tar.zst.sha256",
  "automaticPolicy": {
    "checkOnBoot": true,
    "interval": "5h",
    "downloadOfficialPackages": true,
    "installWithoutLocalConfirmation": false
  },
  "rebootRecommendedFor": [
    "kernel",
    "systemd",
    "graphics-driver"
  ]
}
